,Корреспондент/адресат
0,Министерство иностранных дел Российской Федерации (МИД России)
1,Аппарат Правительства РФ
2,"Комитет Совета Федерации по федеративному устройству, региональной политике, местному самоуправлению и делам Севера"
3,Санкт-Петербургский государственный аграрный университет (ФГБОУ ВО СПбГАУ)
4,Министерство финансов Российской Федерации (Минфин России)
5,Арбитражный суд Хабаровского края
6,Управление федеральной службы судебных приставов по Пермскому краю
7,"ООО ""ССК ""Газрегион"""
8,Среднеахтубинский районный отдел судебных приставов по Волгоградской области
9,УПФР в Выборгском районе Санкт-Петербурга
10,Управление судебного департамента в Ямало-Ненецком АО
11,Военный комиссариат Октябрьского и Советского районов города Рязань Рязанской области
12,УВД по ЦАО ГУ МВД России по г.Москве
13,УВД по ЦАО ГУ МВД Росии по г. Москве
14,Главное управление МЧС России по г. Москве
15,"ООО ""Газпром Трансгаз Чайковский"""
16,Василеостровский РОСП
17,Судебный участок № 8 Дзержинского судебного района Нижегородской области
18,ИФНС России по Коминтерновскому району г. Воронежа
19,Ковернинский районный суд Нижегородской области
20,Департамент образования города Москвы
21,"ООО ""Наследие"""
22,"МОВО по Приморскому району г.СПб - филиал ФГКУ ""УВО ВНГ России по г.СПб и ЛО"""
23,Управление Пенсионного фонда РФ в Василеостровском районе Санкт-Петербурга
24,"ООО  ""Центр технологических присоединений МОЭК"""
25,ГУ МВД России по г.Санкт-Петербургу и Ленинградской области
26,Главное управление Песионного фонда РФ № 4 по Москве и Московской области
27,ОПФР по Камчатскому краю
28,Федеральная налоговая служба (ФНС России)
29,Российская академия наук (РАН)
30,Глава Управы района Тропарево-Никулино Западного административного округа города Москвы
31,Министерство строительства и жилищно-коммунального хозяйства Российской Федерации (Минстрой России)
32,Министерство экономического развития Российской Федерации (Минэкономразвития России)
33,Министерство труда и социальной защиты Российской Федерации (Минтруд России)
34,Институт философии и права Уральского отделения РАН
35,Дальневосточный федеральный университет (ДВФУ)
36,Министерство обороны Российской Федерации (Минобороны России)
37,Пенсионный фонд Российской Федерации (ПФР)
38,Федеральная служба по интеллектуальной собственности (Роспатент)
39,Финансовый университет при Правительстве РФ
40,Межрегиональное операционное управление Федерального казначейства
41,"Санкт-Петербургский филиал ФАУ ""Главгосэкспертиза России"""
42,Кировский районный отдел судебных приставов УФССП по Санкт-Петербургу
43,"ООО ""Микрокредитная компания Денежная масса"""
44,Военный комиссариат Курчатовского и Калининского районов города Челябинск
45,Управление ПФР РФ в Кировском районе г. Уфы Республики Башкортостан
46,Войсковая часть 55060
47,Военный комиссариат города Абакан Республики Хакасия
48,Федеральная таможенная служба Домодедовская таможня
49,ООО УК Татспецтранспорт
50,Европейский университет в Санкт-Петербурге
51,Центр предоставления государственных услуг и установления пенсий пенсионного фонда РФ в Республике Северная Осетия-Алания №1
52,Управление государственной гражданской службы и профилактики коррупционных и иных нарушений Амурской области
53,Российский совет по международным делам
54,Счетная палата РФ
55,Администрация города Муравленко
56,Посольство РФ в Словацкой Республике (г.Братислава)
57,Военный комиссариат Перовского района города Москвы
58,Агенство стратегических инициатив по продвижению новых проектов
59,"Министерство цифрового развития, связи и массовых коммуникаций РФ (Минкомсвязь России)"
60,Никулинская межрайонная прокуратура ЗАО г. Москвы
61,Национальный антитеррористический комитет
62,Российская ассоциация интеллектуальных клубов (РАИК)
63,ИФНС России по г. Иваново
64,Военный комиссариат города Москвы по Гагаринскому району
65,Военный комиссариат города Новотроицк Оренбургской области
66,"Военный комиссариат Удмуртской Республики по г. Глазов, Глазовскому, Балезинскому и Ярскому районам"
67,4 отдел УГИБДД ГУ МВД России по г.Москве
68,Нотариальная палата Пермского края
69,УМВД России по г. Тольятти
70,Отдел МВД России по Апанасенковскому району
71,УМВД России по Дмитровскому району
72,"Союз ""Сибирский Центр медиации"""
73,"Министерство молодежной политики, спорта и туризма Республики Марий Эл"
74,Отделение НДиПР по Ворошиловскому и Центральному районам ОНДиПР по г. Волгограду УНДиПР ГУ МЧС России по Волгоградской области
75,Волго-Вятское главное управление Банка России Отделение по Самарской области
76,Управление Судебного департамента в Республике Тыва
77,Администрация Краснодарского края
78,МРИ ФНС России по крупнейшим налогоплательщикам № 1
79,Прокуратура города Моршанска
80,Министерство образования и науки РФ (Минобрнауки России)
81,"Межрайонный отдел вневедомственной охраны по ЮВАО ФГКУ ""УВО ВНГ России по г. Москве"""
82,ЛУ МВД России в а/п Шереметьево
83,УПФР  в г.Сыктывкаре Республики Коми
84,Управление образования и науки Тамбовской области
85,Министерство здравоохранения РФ (Минздрав России)
86,Департамент образования Администрации Владимирской области
87,Моршанский районный суд
88,Центр Болонского процесса и академической мобильности Министерства образования и науки Республики Казахстан
89,Гражданка
90,Аппарат Правительства Российской Федерации
91,Симоновский районный суд г.Москвы
92,Арбитражный суд города Москвы
93,Министерство экономического развития Астраханской области
94,Минобороны России Военная комендатура гарнизона
95,Высшая аттестационная комиссия при Министерстве науки и высшего образования Российской Федерации
96,Администрация Президента Российской Федерации
97,"Специальный отряд быстрого реагирования ""Терек"" УФСВНГ РФ по Чеченской Республике"
98,"Межмуниципальное управление МВД России ""Балашихинское"""
99,Арбитражный суд Краснодарского края
100,Отдел судебных приставов по Сычевскому и Новодугинскому районам УФССП России по Смоленской области
101,Ассоциация ведущих университетов
102,Совет ректоров высших учебных заведений Москвы и Московской области
103,Администрация муниципального образования город Краснодар
104,Управление Пенсионного фонда РФ № 33 по г. Москве и Московской области
105,ГБОУ Школа № 1948 «Лингвист-М»
106,"Федеральное агентство по делам содружества независимых государств, соотечественников, проживающих за рубежом и по международному гуманитарному сотрудничеству (Россотрудничество)"
107,Министерство юстиции Российской Федерации (Минюст России)
108,Министерство просвещения РФ (Минпросвещения России)
109,Министерство финансов Российской Федерации
110,"АО ""Корпорация ""МСП"""
111,Министерство финансов Республики Тыва
112,"ФГБОУ ВО ""Гжельский государственный унверситет"" (ГГУ)"
113,"Министерство финансов Российской Федерации, Федеральное казначейство"
114,Пятнадцатый арбитражный апелляционный суд
115,УФССП России по Чувашской Республике
116,Управление Федерального казначейства по г. Москве (УФК по г. Москве)
117,Международная Ассоциация Аэропортов (МАА)
118,Губернатор Ульяновской области
119,Правительство Республики Башкортостан
120,"АО ""Федеральная корпорация по развитию малого и среднего предпринимательства"" (АО ""Корпорация ""МСП"")"
121,Гражданин
122,Министерство образования Саратовской области
123,УФССП России по Смоленской области
124,Государственное казенное учреждение города Москвы Центр занятости населения города Москвы (ГКУ ЦЗН)
125,"Общероссийская общественная организация ""Федерация пауэрлифтинга России"""
126,Государственная Дума Федерального собрания РФ седьмого созыва Комитет по охране здоровья
127,"Ассоциация ""Я - профессионал"""
128,"ФГАОУ ВО ""Национальный исследовательский Томский государственный университет"" (ТГУ, НИ ТГУ)"
129,"АНО ""Агентство стратегических инициатив по продвижению новых проектов"""
130,Центр новой молодёжной политики
131,Министерство образования и науки Республики Тыва
132,"Министерство семейной, демографической политики и социального благополучия Ульяновской области"
133,Министерство спорта Нижегородской области
134,"АО ""ДРСК"""
135,ИФНС России № 29 по г. Москве
136,Среднерусский институт управления - филиал РАНХиГС
137,"Государственная Дума Федерального собрания РФ седьмого созыва Комитет по экономической политике, промышленности, инновационному развитию и предпринимательству"
138,Вольное экономическое общество России
139,"АО ""ТРАНСНЕФТЬ-ДИАСКАН"""
140,"Ассоциация организаторов студенческих олимпиад ""Я-профессионал"""
141,_ГалактикаТест
142,УМВД России по Сергиево-Посадскому района
143,"Управление вневедомственной охраны по Центральному
административному округу - ФГКУ «УВО ВНГ России по городу Москве"
144,Военный комиссариат города Бирск и Бирского района Республики Башкортостан
145,Главное управление Пенсионного фонда РФ № 7 по Москве и Московской области
146,Федеральная служба по надзору в сфере образования и науки (Рособрнадзор)
147,Инспекция по контролю за благоустройством городских территорий
148,ЦАФАПОДД ГИБДД ГУ МВД России по Новосибирской области
149,Войсковая часть 53168-А
150,Управление Федерального казначейства по Калужской области
151,ФКУ СИЗО-1 ГУФСИН России по Новосибирской области
152,Аппарат Губернатора Тюменской области
153,Главное управление Министерства юстиции РФ по Нижегородской области
154,Санкт-Петербургский университет технологий управления и экономики
155,Департамент труда и социальной защиты населения города Москвы
156,Российский Союз ректоров
157,Департамент предпринимательства и инновационного развития города Москвы (ДПиИР города Москвы)
158,Государственная Дума Федерального Собрания РФ
159,Кировский филиал РАНХиГС
160,"АО ""Калужский завод ""Ремпутьмаш"""
161,Государственная Дума Федерального собрания Комитет по энергетике
162,Министерство финансов РФ (Минфин России)
163,Счетная палата Российской Федерации
164,Заместитель Губернатора Псковской области
165,ГУ - Отделение Пенсионного фонда Российской Федерации по Ставропольскому краю
166,"ГУП города Москвы по эксплуатации московских водоотводящих систем ""Мосводосток"""
167,Судебный участок № 37 Домодедовского судебного района Московской области
168,Арбитражный суд Ставропольского края
169,"ООО ""Ростинжиниринг"""
170,Военный комиссариат Раменского района ЗАО г. Москвы
171,Управление Росреестра по Москве
172,Администрация города Мегиона Управление по вопросам Муниципальной службы и кадров
173,Министерство природных ресурсов и экологии Российской Федерации (Минприроды России)
174,Комитет Совета Федерации по экономической политике
175,Торгово-промышленная палата Российской Федерации
176,Главное Управление МЧС России по Московской области
177,"Конкурсный управляющий ООО ""ИнфоСвод"""
178,"ПАО ""Московская объединенная электросетевая компания"" (МОЭСК)"
179,УВД по ЮЗАО ГУ МВД России по г.Москве
180,УФССП России по Кировской области
181,"АО ""Мосэнергосбыт"""
182,"МО МВД России ""Верхнесалдинский"""
183,Администрация муниципального округа Ховрино
184,"ФГБУ ""Национальный медицинский исследовательский центр фтизиопульмонологии и инфекционных заболеваний"" Министерства здравоохранения РФ"
185,МИ ФНС России по крупнейшим налогоплательщикам № 1
186,"Межрегиональное территориальное управление Росимущества в Тульской, Рязанской и Орловской областях"
187,Управление Федеральной антимонопольной службы по г. Москве
188,Окружная избирательная комиссия одномандатного избирательного округа № 8 по дополнительным выборам депутата Совета депутатов города Барабинска Барабинского района Новосибирской области четвертого созыва
189,"АНО ""Дирекция спортивных и социальных проектов"""
190,Министерство науки и высшего образования Российской Федерации (Минобрнауки России)
191,Губернатор Самарской области
192,Совет межпарламентской ассамблеи государств - участников СНГ
193,Межрегиональное операционное УФК
194,Федеральное казначейство; Министерство финансов РФ
195,Аппарат Правительства Тульской области
196,Судебный департамент при Верховном суде РФ
197,"ООО ""ДОМОДЕДОВО ТРЕЙНИНГ"""
198,Центральное информационно-техническое таможенное управление ФТС России
199,Индивидуальный предприниматель Мкртчян Марина Леонидовна
200,МВД России (Министерство внутренних дел РФ)
201,УМВД России по г. Челябинску
202,Никулинский районный суд г. Москвы
203,Департамент образования и науки города Москвы
204,Заместитель Председателя Совета Федерации Федерального собрания Российской Федерации
205,Министерство науки и высшего образования РФ (Минобрнауки России)
206,Студент ЮРИУ
207,Судебный участок № 118 Центрального судебного района г.Волгограда
208,Второй арбитражный апелляционный суд
209,"Евразийская организация сотрудничества ""Eurasian Cooperation Organization"""
210,"Санкт-Петербургский национальный исследовательский университет информационных технологий, механики и оптики (Университет ИТМО)"
211,Военный комиссариат г.Москвы Отдел по Савеловскому району
212,"ООО ""Лукойл-Уралнефтепродукт"""
213,"Администрация муниципального образования ""Город Астрахань"""
214,ГУ МВД России по Пермскому краю
215,Управление Федерального казначейства по Свердловской области
216,УФК по г. Санкт-Петербургу
217,Центр ПФР в Пензенской области
218,Санкт-Петербургский государственный университет
219,Межрегиональное управление ФС по финансовому мониторингу по Центральному федеральному округу
220,Администрация города Тулы
221,"Межрегиональное технологическое управление Федеральной службы по экологическому, технологическому и атомному надзору (МТУ Ростехнадзора)"
222,Управление Пенсионного фонда РФ в г. Новом Уренгое Ямало-Ненецкого автономного округа
223,Отдел судебных приставов по г. Ухте УФССП по Республике Коми
224,"Управление государственной гражданской службы, кадровой политики и государственных наград Администрации главы Чувашской Республики"
225,МВД по Республике Тыва
226,ТУ Росимущества в городе Москве
227,Министерство просвещения Российской Федерации (Минпросвещения России)
228,Министерство экономического развития Российской Федерации
229,УВД по СЗАО ГУ МВД России по г. Москве
230,Заместитель губернатора Ямало-Ненецкого автономного округа
231,Федеральная палата адвокатов РФ
232,"АНО ""Университет национальной технологической инициативы 2035"""
233,"ФГБУ науки ""Библиотека по естественным наукам Российской академии наук"" (БЕН РАН)"
234,"ФГБОУ ВПО ""Российский государственный социальный университет"""
235,Центральная избирательная комиссия Республики Карелия
236,Департамент социального развития Тазовского района
237,Управление Роскомнадзора по Центральному федеральному округу
