,Корреспондент/адресат
1466,"ГКУ Московской области ""Мособллес"""
1467,ОБ ДПС ГИБДД Управления МВД России по городу Ставрополю
1468,УВД по ВАО ГУ МВД России по г. Москве
1469,Военный комиссариат города Воркута Республики Коми
1470,Отдел полиции № 7 Управления МВД России по г.Н.Новгороду
1471,УФСБ по Кабардино-Балкарской Республике
1472,МИ ФНС России по ЦОД №4
1473,Аппарат Уполномоченного по правам человека в РФ
1474,"ООО ""Институт социальных технологий"""
1475,ОМВД России по району Ивановское г.Москвы
1476,Управление Роскомнадзора по Воронежской области
1477,Межрайонная ИФНС России № 10 по Санкт-Петербургу
1478,УФССП России по Брянской области
1479,УПФР в г.Ачинске Красноярского края
1480,Московская академия Следственного комитета РФ
1481,ОМВД России по г.Уссурийску
1482,Отдел ФСБ России по Московскому гарнизону
1483,ИФНС России по г.Брянску
1484,Преподавательский состав Уральского института управления
1485,Межрайонная инспекция Федеральной налоговой службы № 1 по Псковской области
1486,ГУ-УПФР в г.Петропавловске-Камчатском Камчатского края
1487,Граждинин
1488,Уполномоченный по правам человека в Свердловской области
1489,Государственная инспекция труда в Астраханской области
1490,Национальная ассоциация трансфера технологий (HATT)
1491,"ООО ""ЭСКО СВЕТ"""
1492,"ООО ""ТехИнжПром"""
1493,Главное управление Министерства внутренних дел Российской Федерации по Саратовской области (ГУ МВД России по Саратовской области)
1494,Министерство образования и науки Республики Калмыкия
1495,Госдударственная инспекция труда в Новгородской области
1496,Военный комиссариат г.Ахтубинск
1497,"Краевое государственное унитарное предприятие ""Приморский водоканал"""
1498,ИФНС России по г.Йошкар-Оле
1499,УФССП по Брянской области ОСП по Новозыбковскому и Климовскому районам
1500,Девятый кассационный суд общей юрисдикции г.Владивосток
1501,Компания First Advantage
1502,Александринская горно-рудная компания
1503,Астраханская таможня
1504,Департамент региональной безопасности и противодействия коррупции города Москвы
1505,"ООО ""Айди Партнер"""
1506,ФГУП «СВЭКО»
1507,Швейцарская академия международного права (SAIL)
1508,Правительство Кемеровской области-Кузбасса
1509,УВО по г. Сочи - филиал ФГКУ «УВО ВНГ России по Краснодарскому краю»
1510,Межрайонная ИФНС России № 6 по Новгородской области
1511,УПФР по Советскому району г.Владивостока Приморского края
1512,МО МВД России Дорогобужский
1513,Отдел социальной защиты населения по Веневскому району Тульской области
1514,Министерство энергетики и жилищно-коммунального хозяйства Мурманской области
1515,"Санкт-Петербургское ГКУ ""Жилищное агентство Невского района Санкт-Петербурга"""
1516,Мосгосстройнадзор
1517,"АО ""Федеральная пассажирская Компания"" (АО ФПК)"
1518,Главное управление Федеральной службы войск национальной гвардии РФ по г.Москве
1519,"ООО ""ВЕС-Медиа"""
1520,Управление кадрового и специального обеспечения ГФС России
1521,"ФГБОУ ВО ""Московский государственный психолого-педагогический университет"""
1522,"АО ""ПРОМИНДУСТРИЯ АГ"""
1523,"Международный мультимедийный пресс-центр МИА ""Россия сегодня"""
1524,Академия государственного управления при Президенте Кыргызской Республики
1525,Глава Республики Саха (Якутия)
1526,АНО «Агентство по развитию человеческого капитала на Дальнем Востоке»
1527,Министерство образования и науки Калужской области
1528,Администрация Горномарийского муниципального района
1529,Избирательная комиссия городского округа г. Воронеж
1530,Исправительная колония № 10 УФСИН России по Саратовской области
1531,Федеральное учебно-методическое объединение в системе среднего профессионального образования по укрупненной группе специальностей
1532,Прокуратура Полесского района
1533,Департамент (представительство Самарской области) по взаимодействию с федеральными органами государственной власти
1534,Военный комиссариат г.Южно-Сахалинск
1535,Ростовская таможня
1536,Отдел судебных приставов Центрального района г. Калининграда УФССП России по Калиниградской области
1537,УФССП России по Ростовской области
1538,Управление Росреестра по Свердловской области
1539,Российский научный фонд
1540,Департамент государственной гражданской службы и кадров
1541,ГУ МВД по г.Москве Полк охраны и конвоирования подозреваемых и обвиняемых
1542,Собрание депутатов Миллеровского городского поселения
1543,ОСЗН района Ясенево
1544,МГУ имени М.В.Ломоносова
1545,Право.ru
1546,"ПАО ""МОЭСК"""
1547,Преображенский районный суд города Москвы
1548,Межрайонная ИФНС России № 12 про Тульской области
1549,Мировой судья судебного участка № 11 Советского судебного района г.Брянска
1550,Второй кассационный суд общей юрисдикции
1551,ИФНС России по Центральному району г.Новокузнецка Кемеровской области
1552,Посольство Республики Казахстан в РФ
1553,"Межмуниципальный отдел МВД России ""Нижневартовский"""
1554,УПФР в городе-курорте Геленджик Краснодарского края
1555,РУМЦ МГППУ
1556,ИФНС России по г.Петрозаводску
1557,Военный комиссариат города Москвы отдел по Даниловскому району
1558,Управление Росгвардии по Свердловской области
1559,Министерство образования и науки Республики Бурятия
1560,Коллектив Уральского института управления РАНХиГС
1561,Институт политических исследований
1562,Главное управление Пенсионного фонда России № 2 по г. Москве и Московской области
1563,Администрация Президента РФ Экспертное управление
1564,МВД по Республике Бурятия
1565,Войсковая часть 75388
1566,"ООО ""Управляющая компания «Предприятие жилищно-коммунального хозяйства» (ООО «УК «ПЖКХ»)"
1567,"ГОУ ""Российский экономический университет имени Г.В.Плеханова"""
1568,Аппарат Государственной Думы Федерального Собрания РФ
1569,ГУ - Региональное отделение Фонда социального страхования Российской Федераци по Республике Саха (Якутия)
1570,Всероссийская академия внешней торговли Министерства экономического развития РФ
1571,"АНО ""Центр стратегических исследований Ульяновской области"""
1572,"АО ""Мосводоканал"""
1573,Военный комиссариат Кунцевского района ЗАО
1574,ФКУ ЦХиСО УМВД России по Ханты-Мансийскому округу-Югре
1575,УСЗН в Карасунском округе г.Краснодара
1576,"Корпоративная некоммерческая организация ""Всемирная ассоциация выпускников"""
1577,Доцент кафедры гражданско-правовых дисциплин Волгоградского института управления - филиала РАНХиГС
1578,Центр спортивной подготовки сборных команд России
1579,УФНС России по Ханты-Мансийскому автономному округу-Югре
1580,Центральное таможенное управление
1581,Министерство экономического развития и туризма Республики Алтай
1582,Министерство здравоохранения Ульяновской области
1583,Отдел МВД России по городу Бердску
1584,Севастопольская таможня
1585,Главное управление Росгвардии по городу Москве
1586,Войсковая часть 6898
1587,Студент ЭМИТ
1588,Военный комиссариат индустриального и дзержинского районов г.Пермь
1589,"ИД ""БигДата Медиа"""
1590,"УМВД России по Тамбовской области МО МВД РФ ""Уваровский"""
1591,"Общественное движение Объединение граждан России ""Источник Власти"""
1592,Управление Федеральной службы войск национальной гвардии РФ по Новосибирской области
1593,Белгородская таможня
1594,ГУФССП России по г.Москве Отдел судебных приставов по Центральному административному округу № 2
1595,Кинешемский РОСП УФССП по Ивановской области
1596,МОО Содействия розыску и обращению имущества в государственную собственность
1597,Посольство Российской Федерации в Великобритании
1598,Уральское таможенное управление
1599,"Общероссийская общественная организация ""Ассоциация юристов России"""
1600,ФКУ ГЦИТОиС ФСИН России
1601,УМВД России по Калининградской области
1602,"МОВО по г.Невинномысску - филиал ФГКУ ""УВО ВНГ России по Ставропольскому краю"""
1603,Федеральное агентство по рыболовству (Росрыболовство)
1604,Корпоративные исследования ООО
1605,студентка ИОН
1606,Общественная палата РФ
1607,"ООО ""ГрадиМир"""
1608,Межмуниципальный отдел вневедомственной охраны по городу Саратову
1609,УВД по городу Сочи ГУ МВД России по Краснодарскому краю
1610,Центр ПФР №2 по установлению пенсий в Хабаровском крае
1611,Хамовническая межрайонная прокуратура ЦАО г. Москвы
1612,Российское историческое общество
1613,"Военный комиссариат городов Раменское, Жуковский и Бронницы Московской области"
1614,Таймырский ЛО МВД России
1615,"ООО ЛУКОЙЛ-Западная Сибирь ТПП ""Покачевнефтегаз"""
1616,"Благотворительный Фонд ""Наследие страны"""
1617,"АО ""Газпромбанк"""
1618,Фонд ДОМ.РФ
1619,"ГУ - ГУПФР № 10 по г.Москве и Московской области Управление по приему населения Клиентская служба ""Басманный"""
1620,"АО ""Жилищный строительный сберегательный банк Казахстана"""
1621,Автономная некоммерческая организация Центр студенческих программ Российского союза молодежи
1622,Министерство связи и массовых коммуникаций РФ (Минкомсвязь России)
1623,Рузский центр обеспечения пунктов управления МЧС России
1624,Администрация Ленинск-Кузнецкого городского округа
1625,Главное управление МЧС России по Орловской области
1626,Военный комиссариат Республики Бурятия Отдел по Иволгинскому району
1627,ФКУ ИК-27 ОУХД УФСИН России по Кировской области
1628,Благотворительный фонд Владимира Потанина
1629,Окружная избирательная комиссия одномандатного избирательного округа № 4 по выборам депутатов Законодательного собрания Новосибирской области седьмого созыва
1630,Research Associate Exiger Diligence
1631,УПФР в г.Старый Оскол и Старооскольском районе Белгородской области
1632,УПФР по Охинскому району Сахалинской области
1633,Глава Республики Башкортостан
1634,Военный комиссариат Краснодарского края
1635,Комитет по экономике и развитию Курской области
1636,ГКР ВЭБ.РФ
1637,Управление Роскомнадзора по Самарской области
1638,Центр аналитики города
1639,Студент ИГСУ
1640,Прокуратура Балаклавского района
1641,"Минобороны России ФГАУ Военный инновационный технополис ""ЭРА"""
1642,ОПФР по Челябинской области
1643,Даниловский ОСП УФССП России по г.Москве
1644,Никулинский районный суд г.Москвы
1645,"ООО ""Газпром межрегионгаз Волгоград"""
1646,Военный комиссариат Солнцевского района ЗАО г. Москвы
1647,Минобороны России Объединенное стратегическое командование Южного военного округа
1648,ФКУ ЖКУ УФСИН России по Удмуртской Республике
1649,ОМВД России по Туапсинскому району
1650,УФССП России по Республике Ингушетия
1651,"МО МВД России ""Ржевский"""
1652,Управление Росгвардии по Ульяновской области
1653,Центральная электронная таможня
1654,"Филиал ПАО ""МОЭСК"" - Московские кабельные сети"
1655,"АО ""Вертолеты России"""
1656,"Хабаровский филиал ООО ""Торговый дом Полиметалл"""
1657,Волжское межрегиональное управление Государственного автодорожного надзора (Волжское МУГАДН РОСТРАНСНАДЗОРА)
1658,Восточно-Европейский Институт психоанализа
1659,Министерство внутренних дел по Республике Калмыкия
1660,ИАЗ ООПДАП ЦАФАПОДД ГИБДД ГУ МВД по Челябинской области
1661,Resource Solutions
1662,Пушкинский районный отдел судебных приставов УФССП по Московской области
1663,Минобороны России Национальный центр управления обороной РФ
1664,"ООО ""ГЕОИЗОЛ"""
1665,Министерство науки и высшего образования РФ
1666,Глава Управы района Аэропорт города Москвы
1667,МВД России Академия управления
1668,Военный комиссариат Ленинского и Октябрьского административных округов города Омск Омской области
1669,Военный комиссариат Республики Хакасия
1670,ИФНС России по Советскому району г.Н.Новгорода
1671,Военный комиссариат Бакалинского и Шаранского районов Республики Башкортостан
1672,Военный комиссариат Гагаринского и Балаклавского районов города Севастополь
1673,Военный комиссариат Калининского и Центрального округов города Тюмень
1674,Военный комиссариат Челябинской области по Калининскому району
1675,Федеральное собрание Российской Федерации Комитет Совета Федерации по международным делам
1676,ОПФР по Санкт-Петербургу и Ленинградской области
1677,Студенты Алтайского филиала
1678,Межрайонная ИФНС России № 4 по Орловской области
1679,"Минобрнауки России ФГБНУ ""Аналитический центр"""
1680,Стэнфордский российско-американский форум
1681,"ФГБОУ ВО ""Алтайский государственный университет"""
1682,Государственное бюджетное учреждение дополнительного образования города Москвы «Детская школа искусств им. А.С. Даргомыжского»
1683,НИУ ВШЭ
1684,"АО ""Федеральная корпорация по развитию малого и среднего предпинимательства"""
1685,Национальный институт технического регулирования
1686,"ГБУ г. Москвы ""Малый бизнес Москвы"""
1687,Мильковский МО МВД России
1688,Отдел МВД России по г. Бердску Новосибирской области
1689,МВД по Чувашской Республике
1690,"Сетевое издание ""Интермонитор"""
1691,"ГБУ ""Малый бизнес Москвы"""
1692,Детская школа искусств им. А.С.Даргомыжского
1693,Министерство здравоохранения Московсой области
1694,ИФНС России по Октябрьскому району г.Владимира
1695,УМВД России по г.Петрозаводску
1696,УПФР №7 по Москве и Московской области
1697,ФГКУ УВО ВНГ России по Тульской области
1698,ОМВД России по Сузунскому району
1699,ОМВД России по Нефтеюганскому району
1700,Военный комиссариат города Судак Республики Крым
1701,Администрация муниципального образования город-курорт Геленджик
1702,Следственный комитет по городу Якутску
1703,Избирательная комиссия Иркутской области
1704,УМВД России по г.Ялте
1705,"231 военная прокуратура гарнизона,войсковая часть 36782"
1706,EXIGER
1707,Калиниградская областная таможня
1708,МО МВД России Гусевский
1709,Управление Росгвардии по Карачаево-Черкесской Республики
1710,Josef Silny&Associates Inc
1711,УМВД России по Ярославской области
1712,ГУ - Центр по выплате пенсий и обработке информации пенсионного фонда РФ в Калининградской области
1713,Управа района Аэропорт города Москвы САО
1714,Управление Федеральной антимонопольной службы по Москве (УФАС по г. Москве)
1715,Министерство общего и профессионального образования Свердловской области
1716,Межрегиональный филиал ФКУ «ЦОКР» в г. Хабаровске
1717,"АО ""ЭР-Телеком Холдинг"""
1718,"ПАО ""Волгоградэнергосбыт"""
1719,"ФГКУ ""УВО ВНГ России по КБР"""
1720,"ООО ""Лукойл-Центр управление режимами"""
1721,"ФГКУ ""УВО ВНГ России по Ханты-Мансийскому автономному округу - Югре"""
1722,"ООО ""ЛУКОЙЛ-Интер-Кард"""
1723,Academic Information Centre
1724,УФНС России по Тюменской области
1725,"ФГУП ""Информационное телеграфное агентство России (ИТАР-ТАСС)"""
1726,Постоянное представительство Республики Ингушетия при Президенте РФ
1727,Управление по административно-техническому надзору администрации города Тулы
1728,ГУ - ГУ ПФРФ № 8 по Москве и Московской области
1729,Московская областная таможня
1730,Избирательная комиссия Новосибирской области
1731,Главное управление МЧС по Республике Алтай
1732,Отдел МВД России по Черепановскому району
1733,Войсковая часть 12676
1734,Администрация г.Белгорода
1735,"ПАО ""Газпром нефть"""
1736,Представительство Правительства Тюменской области в органах государственной власти
1737,Управление Роскомнадзора по Челябинской области
