,Корреспондент/адресат
3060,Администрация Губернатора Архангельской области и Правительства Архангельской области
3061,Военный комиссариат Центрального и Советского административных округов город Омск Омской области
3062,Отделение судебных приставов по Советскому району г. Томска УФССП России по Томской области
3063,Оренбургский ЛО МВД России на транспорте
3064,УМВД России по Центральному району г.СПб
3065,"МО МВД России ""Тобольский"""
3066,Отдел социальной защиты населения Войковского района
3067,АО «Нижегородский водоканал»
3068,"ООО ""ЛОВТЕКС"""
3069,Геленджикское ГОСП ГУФССП по Краснодарскому краю
3070,Судебный участок № 21 Краснофлотского района г.Хабаровска
3071,"Военный комиссариат г.Ржев, Ржевского, Зубцовского и Старицкого районов Тверской области"
3072,"Государственное бюджетное учреждение Тюменской области ""Государственный архив Тюменской области"" (ГБУТО ГАТО)"
3073,Военный комиссариат города Курган
3074,"Военный комиссариат города Светлоград, Петровского и Грачевского районов Ставропольского края"
3075,МО МВД России Дальнереченский
3076,"Краевое государственное бюджетное учреждение ""Многофункциональный центр предоставления государственных и муниципальных услуг"""
3077,Российский студенческий спортивный союз
3078,Центр ПФР №1 по установлению пенсий в Волгоградской области
3079,УФК по г.Москве
3080,"ООО ""Центр информационной и выставочной деятельности атомной отрасли"""
3081,Отдел социальной защиты населения района Отрадное Северо-Восточного административного округа горочда Москвы
3082,"ФГБУ ""Центр защиты прав и интересов детей"""
3083,Администрация Губернатора Самарской области
3084,Посольство Королевства Иордании в Российской Федерации
3085,Международный казахско-турецкий университет имени Ходжа Ахмеда Ясави
3086,"Ассоциация ""СИЗ"""
3087,"АО ""Новосибирскавтодор"""
3088,"ООО ""ТЕХНОШКОЛА"""
3089,"ФГАОУ ВО ""Национальный исследовательский ядерный университет ""МИФИ"" (НИЯУ МИФИ)"
3090,Московский технический университет связи и информатики (МТУСИ)
3091,Центральное межрегиональное управление государственного автодорожного надзора Федеральной службы по надзору в сфере транспорта (Центральное МУГАДН)
3092,Управление Федеральной службы войск национальной гвардии Российской Федерации по Республике Коми Отряд мобильный особого назначения (г. Воркута)
3093,ИФНС России по Ленинскому району г. Екатеринбурга
3094,INTERNATIONAL SOS WORLDWIDE REACH. HUMAN TOUCH
3095,"МО МВД России ""Советский"""
3096,Военный комисариат города Нижневартовск и Нижневартовского района Ханты-Мансийского автономного округа-Югры
3097,Военный комиссариат Первомайского и Ленинского районов города Ижевск и Завьяловского района Удмуртской Республики
3098,Военный комиссариат города Тында Амурской области
3099,Документ 24
3100,"МБОУ ""Средняя общеобразовательная школа № 15 им. Цахаева 3.3"""
3101,Управление Росгвардии по Республике Ингушетия
3102,Министерство юстиции Республики Тыва
3103,Военный комиссариат города Волжский Волгоградской области
3104,Министерство физической культуры и спорта Ульяновской области
3105,"ФГБОУ ВО ""Калмыцкий государственный университет им. Б.Б. Городовикова"""
3106,Ассоциация научных и учебных организаций - пользователей электронных сетей передачи данных «РЕЛАРН»
3107,Ассоциация юристов в сфере ликвидации и банкротства
3108,Агентство по имуществу Калининградской области
3109,Министерство здравоохранения Республики Коми
3110,Дорогомиловский ОСП УФССП России по г. Москве
3111,Северный районный суд города Орла
3112,ОМВД РФ по Ахтубинскому району
3113,Общество с ограниченной ответственностью «Кургантехэнерго»
3114,Преображенский отдел судебных приставов УФССП России по г. Москве
3115,Управление Центрального Оршанско-Хинганского Краснознаменного округа войск национальной гвардии РФ
3116,УМВД России по Адмиралтейскому району г. Санкт-Петербург
3117,Совет Федерации Федерального собрания Российской Федерации
3118,Министерство внутренней региональной и муниципальной политики Нижегородской области
3119,Филиал № 15 Свердловского регионального отделения Фонда социального страхования РФ
3120,Межрайонная ИФНС России № 46 по г. Москве
3121,Военный комиссариат города Октябрьский Республики Башкортостан
3122,Главное управление Росгвардии по г.Москве
3123,Военный комиссариат Ярославской области
3124,"ФКУ ""Российский государственный архив экономики"" (РГАЭ)"
3125,Военный комиссариат города Новокуйбышевск Самарской области
3126,Федеральная служба войск национальной гвардии Российской Федерации Войсковая часть 3128
3127,Администрация Партизанского муниципального района Приморского края
3128,Межрайонная ИФНС России № 2 по Самарской области
3129,Северное межрегиональное управление Росприроднадзора
3130,ОМВД России по Верхнебуреинскому району
3131,"АО ""Выставка достижений народного хозяйства"""
3132,"ООО ""ВСП Глобал"""
3133,Правительство Челябинской области Управление государственной службы и противодействия коррупции
3134,"ФГБОУ ВО ""Государственный университет управления"" (ГУУ)"
3135,"АНО ""Научный центр перспективных междициплинарных исследований ""Идея"""
3136,Правительство Приморского края
3137,Министерство здравоохранения Республики Карелия
3138,Военный комиссариат города Тейково и Тейковского района Ивановской области
3139,"Межмуниципальный отдел МВД России ""Перевозский"""
3140,Управление Пенсионного фонда РФ в г. Нефтекамск Республики Башкортастан
3141,Военный комиссариат Ленинского и Фрунзенского районам города Владивосток
3142,ФСО России Служба специальной связи и информации
3143,"ФГБПОУ ""Колледж Министерства иностранных дел Росссийской Федерации"""
3144,Отделение судебных приставов по г. Вологде № 2 УФССП по Вологодской области
3145,"Военный комиссариат города Фролово,Иловлинского,Ольховского и Фроловского районов Волгоградской обла"
3146,"ООО ""Гельд-Трейд"""
3147,Обнинское ГОСП УФССП России по Калужской области
3148,Губернатор Омской области
3149,Следственное управление по Брянской области (СУ СК России по Брянской области)
3150,Главное управление МЧС России по Воронежской области
3151,Ассоциация по развитию международных исследований и проектов в области энергетики «Глобальная энергия»
3152,Государственный музей изобразительных искусств имени А.С.Пушкина
3153,"АО ""Информационные спутниковые системы"" имени академика М.Ф. Решетнёва"""
3154,Министерство финансов Омской области
3155,"ООО ""АЗК Строй Групп"""
3156,Федеральная служба войск национальной гвардии Войсковая часть 3642
3157,Отдел судебных приставов по г. Вологде № 2 УФССП по Вологодской области
3158,"Управление опеки и попечительства Министерства образования Московской области по городским округам Люберцы, Дзержинский, Котельники и Лыткарино"
3159,УМВД России по Магаданской области
3160,УМВД России по Выборгскому району Ленинградской области
3161,"Военный комиссариат Ершовского, Дергачевского и Озинского районов Саратовской области"
3162,Управление Пенсионного фонда РФ в городе Асбесте Свердловской области
3163,"Главное управление Пенсионного фонда РФ № 7 по Москве и Московской области Клиентская служба «Измайлово, Северное Измайлово, Восточное Измайлово, Соколиная гора»"
3164,Военный комиссариат Калининского и Центрального админстративных округов города Тюмень
3165,Научно-образовательный центр «Кузбасс»
3166,Национальная ассоциация научных изданий (НАНИ)
3167,Евразийская экономическая комиссия Департамент энергетики
3168,"""Иркутский национальный исследовательский технический университет"""
3169,Управление исполнения заключений Регионального центра сопровождения розничного бизнеса Операционный центр г. Нижний Новгород ПАО Сбербанк
3170,ГУ-УПФР № 1 по г.Москве и Московской области Управление по городскому округу Солнечногорск
3171,"Межмуниципальный отдел МВД России ""Ремонтненский"""
3172,Управление Пенсионного фонда РФ в г. Салехарде и Приуральском районе Ямало-Ненецкого автономного округа
3173,Военный комиссариат города Братск Иркутской области
3174,Федеральное агентство по недропользованию Департамент по недропользованию по Дальневосточному федеральному округу (Дальнедра)
3175,УФССП России по Пермскому краю
3176,ОМОН Управления Федеральной службы войск национальной гвардии РФ по Новосибирской области
3177,УПФР в г.Новочебоксарск
3178,ОАТИ г.Москвы
3179,Управление делами Главы и Правительства Кабардино-Балкарской Республики
3180,"Главное управление Пенсионного фонда РФ № 2 по Москве и Московской области Клиентская служба ""Очаково-Раменки"""
3181,"Молодежная общероссийская общественная организация ""Российские Студенческие Отряды"""
3182,Северо-Осетинский республиканский институт повышения квалификации работников образования
3183,ФКУ СИЗО-3 УФСИН России по Московской области
3184,Студентка заочной магистратуры
3185,МРИ ФНС России по крупнейшим налогоплательщикам №1
3186,"Главное управление Пенсионного фонда РФ № 4 по г. Москве и Московской области Клиентская служба ""Коньково-Черемушки"""
3187,"Управление Россельхознадзора по городу Москва, Московской и Тульской областям"
3188,ОСП по Юго-Восточному Административному округу УФССП России по Москве
3189,ОСП по Центральному району г. Симферополя УФССП России по Республике Крым
3190,ФГБОУ ВО «МИРЭА - Российский технологический университет»
3191,Военный комиссариат Советского и Центрального районов г.Челябинск Челябинской области
3192,Савеловский отдел судебных приставов ГУФССП России по городу Москве
3193,Военный комиссариат г.Горно-Алтайска Республики Алтай
3194,Управление Пенсионного фонда РФ в Советском районе г. Нижнего Новгорода
3195,Министерство транспорта и дорожного хозяйства Кабардино-Балкарской Республики (Минтранс КБР)
3196,Военный комиссариат городского округа город Тула Тульской области
3197,Военный комиссариат города Новый Уренгой Ямало-Ненецкого автономного округа
3198,Военный комиссариат Западного и Прикубанского округов города Краснодара
3199,ДЭК Хабаровскэнергосбыт
3200,Аппарат Совета Министров  Республика Крым
3201,БУ ЧР ДПО «Чувашский республиканский институт образования» Минобразования Чувашии
3202,Публичное акционерное общество «Аэрофлот - российские авиалинии» (ПАО «Аэрофлот»)
3203,Правительство Брянской области
3204,ИФНС России по г. Красногорску Московской области
3205,"ООО ""Газпром добыча Ямбург"" Служба корпоративной защиты"
3206,Социальный отдел управы района Замоскворечье
3207,Национальный информационный центр академической мобильности Министерства образования и науки Украины (ENIC Ukraine)
3208,"Управление опеки и попечительства Московской области по городским округам Люберцы,Дзержинский,Котельники и Лыткарино"
3209,ФКУ СИЗО-3 УФСИН России по Калининградской области
3210,"Муниципальное бюджетное учреждение Копейского городского округа Челябинской области «Многофункциональный центр по предоставлению государственных и муниципальных услуг» (МБУ ""МФЦ"")"
3211,"Военный комиссариат Ярославской области г. Тутаев, Большесельского и Тутаевского районов Ярославской области"
3212,Отряд мобильный особого назначения (г.Магнитогорск)
3213,ФКУ ИК-2 УФСИН России по Ярославской области
3214,Комитет по здравоохранению Псковской области
3215,"Департамент муниципальной службы, кадров и делопроизводства аппарата администрации города Иркутска"
3216,"Хабаровский филиал ООО ""Торговый дом ПОЛИМЕТАЛЛ"""
3217,Министерство энергетики РФ (Минэнерго России)
3218,"ООО Строительная Корпорация ""СТАТУС"""
3219,"Фонд научных исследований ""XXI век"""
3220,Комитет юстиции Волгоградской области
3221,ОСП по Первомайскому и Староюрьевскому районам УФССП по Тамбовской области
3222,"Госкорпорация ""Росатом"""
3223,Управление Пенсионного фонда РФ в Автозаводском районе города Тольятти
3224,"Главное управление Пенсионного фонда РФ № 3 по г. Москве и Московской области Клиентская служба ""Люберцы, Котельники"""
3225,Межрайонная ИФНС России №10 по Удмуртской Республике
3226,Главное управление государственной службы и кадров Тульской области
3227,УФССП России по Приморскому краю
3228,"Военный комиссариат Ленинского,Заводского и Центрального районов города Кемерово"
3229,"ФГБУ ""Научно-исследовательский институт ""Восход"" (ФГБУ НИИ ""Восход"")"
3230,Глава муниципального района «Сулейман-Стальский район» Республики Дагестан
3231,Межрегиональная инспекция Федеральной налоговой службы по централизованной обработке данных (МИ ФНС России по ЦОД)
3232,МБОУ «Заречненская школа с крымскотатарским языком обучения - детский сад»
3233,Всероссийский студенческий корпус спасателей
3234,"Муниципальный район ""Сулейман-Стальский район"" Управление образования администрации"
3235,"Администрация Джанкойского района Республики Крым Управление образования, молодежи и спорта"
3236,Администрация Главы Республики Адыгея
3237,ОМВД России по г.Нефтеюганску
3238,Служба по обеспечению деятельности мировых судей Кабардино-Балкарской Республики (Служба ОДМС КБР)
3239,Руководитель НИЦ национальных проблем образования ФИРО РАНХиГС
3240,ГУ МВД России по Краснодарскому краю Главное следственное управление
3241,"АНО ВО ""Университет Иннополис"""
3242,Институт повышения квалификации работников образования Республики Ингушетия (ГБОУ ДПО ИПК РО РИ)
3243,Департамент цифрового развития Владимирской области
3244,"ООО ""ЛокоТех"""
3245,Военный комиссариат Октябрьского и Железнодорожного районов города Пенза Пензенской области
3246,ОМВД России по Волоколамскому городскому округу
3247,Отдел социальной защиты населения района Отрадное Северо-Восточного административного округа города Москвы
3248,Главное архивное управление города Москвы (Главархив Москвы)
3249,УПФР по Буденновскому муниципальному району Ставропольского края
3250,УВД по САО ГУ МВД России по г. Москве
3251,УФССП России по Ханты-Мансийскому автономному округу-Югре
3252,Военный комиссариат города Йошкар-Ола Республики Марий Эл
3253,"ООО ""Лукойл-Инжиниринг"""
3254,Государственный комитет охраны объектов культурного наследия Челябинской области
3255,Военный комиссариат Бутырского района СВАО города Москвы
3256,Межрайонная ИФНС России №1 по Самарской области
3257,Военный комиссариат города Жигулевск и Ставропольского района Самарской области
3258,"Акционерное общество ""Выставка достижений народного хозяйства"" (АО ""ВДНХ"")"
3259,УФССП России по Камчатскому краю и Чукотскому АО
3260,Прокуратура Приморского края Прокуратура Ленинского района г.Владивостока
3261,ТГПУ им.Л.Н.Толстого
3262,"Министерство цифрового развития государственного управления, информационных технологий и связи Республики Татарстан"
3263,Замоскворецкий районный суд г. Москвы
3264,Измайловский районный суд г. Москвы
3265,Государственный музей-усадьба «Архангельское»
3266,Санкт-Петербургский городской суд
3267,Унечский РОСП УФССП по Брянской области
